[
  {
    "id": "EUV-WAVELENGTH-001",
    "component": "source",
    "claim": "Commercial EUV lithography uses radiation around 13.5 nm.",
    "class": "A",
    "confidence": 1.0,
    "sources": [
      { "name": "ASML lithography principles", "url": "https://www.asml.com/en/technology/lithography-principles" },
      { "name": "ZEISS EUV overview", "url": "https://www.zeiss.com/semiconductor-manufacturing-technology/smt-magazine/so-does-euv-lithography-work.html" }
    ]
  },
  {
    "id": "HIGHNA-NA-001",
    "component": "projection",
    "claim": "High-NA EUV raises numerical aperture from 0.33 to 0.55.",
    "class": "A",
    "confidence": 1.0,
    "sources": [
      { "name": "ZEISS High-NA EUV", "url": "https://www.zeiss.com/semiconductor-manufacturing-technology/inspiring-technology/high-na-euv-lithography.html" }
    ]
  },
  {
    "id": "HIGHNA-ILLUMINATION-001",
    "component": "illuminator",
    "claim": "ZEISS reports that the High-NA illumination system contains more than 25,000 parts and weighs over six tons.",
    "class": "A",
    "confidence": 1.0,
    "sources": [
      { "name": "ZEISS High-NA EUV", "url": "https://www.zeiss.com/semiconductor-manufacturing-technology/inspiring-technology/high-na-euv-lithography.html" }
    ]
  },
  {
    "id": "HIGHNA-PARTS-001",
    "component": "projection",
    "claim": "ZEISS reports more than 40,000 parts in High-NA projection optics, weighing around twelve tons.",
    "class": "A",
    "confidence": 1.0,
    "sources": [
      { "name": "ZEISS High-NA EUV", "url": "https://www.zeiss.com/semiconductor-manufacturing-technology/inspiring-technology/high-na-euv-lithography.html" }
    ]
  },
  {
    "id": "HIGHNA-ANAMORPHIC-001",
    "component": "projection",
    "claim": "ASML describes High-NA EXE anamorphic optics as demagnifying the reticle pattern 4x in one direction and 8x in the other, resulting in an exposure field half the size of NXE.",
    "class": "A",
    "confidence": 1.0,
    "sources": [
      { "name": "ASML - 5 things you should know about High NA EUV lithography", "url": "https://www.asml.com/en/en/news/stories/2024/5-things-high-na-euv" }
    ]
  },
  {
    "id": "TSMC-N7PLUS-001",
    "component": "fab-integration",
    "claim": "TSMC N7+ was its first EUV process to enter volume production, beginning volume production in 2019.",
    "class": "A",
    "confidence": 1.0,
    "sources": [
      { "name": "TSMC N7+ technology", "url": "https://www.tsmc.com/english/campaign/N7plus" },
      { "name": "TSMC 7nm technology", "url": "https://www.tsmc.com/english/dedicatedFoundry/technology/logic/l_7nm" }
    ]
  },
  {
    "id": "TSMC-N6-001",
    "component": "fab-integration",
    "claim": "TSMC states N6 uses additional EUV layers and has been in volume production since 2020.",
    "class": "A",
    "confidence": 1.0,
    "sources": [
      { "name": "TSMC advanced smartphone technologies", "url": "https://www.tsmc.com/english/dedicatedFoundry/technology/platform_smartphone_tech_advancedTech" }
    ]
  },
  {
    "id": "SAMSUNG-7LPP-EUV-2018",
    "component": "fab-integration",
    "claim": "Samsung announced on October 18, 2018 that it had started wafer production of its 7LPP process using EUV lithography, with initial production at its S3 Fab in Hwaseong, Korea.",
    "class": "A",
    "confidence": 1.0,
    "sources": [
      { "name": "Samsung Electronics Starts Production of EUV-based 7nm LPP Process", "url": "https://news.samsung.com/us/samsung-electronics-starts-production-euv-based-7nm-lpp-process/" }
    ]
  },
  {
    "id": "SAMSUNG-V1-EUV-2020",
    "component": "fab-integration",
    "claim": "Samsung announced in February 2020 that its V1 line in Hwaseong had begun mass production and was Samsung's first semiconductor production line dedicated to EUV lithography, producing at 7 nm and below.",
    "class": "A",
    "confidence": 1.0,
    "sources": [
      { "name": "Samsung Electronics Begins Mass Production at New EUV Manufacturing Line", "url": "https://news.samsung.com/global/samsung-electronics-begins-mass-production-at-new-euv-manufacturing-line" }
    ]
  },
  {
    "id": "INTEL-HIGHNA-D1X-2024",
    "component": "fab-integration",
    "claim": "Intel reported in April 2024 that installation of its ASML High-NA EUV tool at D1X in Hillsboro, Oregon was complete and calibration had started; Intel described the 165-ton system as the industry's first commercial High-NA EUV lithography system.",
    "class": "A",
    "confidence": 1.0,
    "sources": [
      { "name": "Intel Press Kit: High NA EUV at Intel", "url": "https://newsroom.intel.com/press-kit/intel-high-na-euv" }
    ]
  },
  {
    "id": "MICRON-1GAMMA-EUV-2025",
    "component": "fab-integration",
    "claim": "Micron states that its 1-gamma DRAM technology uses EUV lithography and describes 1-gamma as its first DRAM node to use EUV in production.",
    "class": "A",
    "confidence": 0.99,
    "sources": [
      { "name": "Micron 1-gamma DRAM technology", "url": "https://www.micron.com/products/memory/1gamma-dram-technology" }
    ]
  },
  {
    "id": "SKHYNIX-1ANM-EUV-2021",
    "component": "fab-integration",
    "claim": "SK hynix announced in July 2021 that it had started mass production of 1anm 8Gb LPDDR4 DRAM using EUV equipment, its first EUV adoption for mass production after partial use in 1ynm DRAM production.",
    "class": "A",
    "confidence": 1.0,
    "sources": [
      { "name": "SK hynix Starts Mass Production of 1anm DRAM Using EUV Equipment", "url": "https://news.skhynix.com/sk-hynix-starts-mass-production-of-1anm-dram-using-euv-equipment/" }
    ]
  },
  {
    "id": "RAPIDUS-IIM1-EUV-2025",
    "component": "fab-integration",
    "claim": "Rapidus states that an ASML TWINSCAN NXE:3800E was installed at IIM-1 in December 2024 and that installation was completed by April 1, 2025 before full-auto EUV pattern exposure and development milestones.",
    "class": "A",
    "confidence": 1.0,
    "sources": [
      { "name": "Rapidus - EUV lithography at IIM-1", "url": "https://www.rapidus.inc/en/tech/te0005/" },
      { "name": "Rapidus IIM manufacturing hub", "url": "https://www.rapidus.inc/en/iim/" }
    ]
  },
  {
    "id": "PATENT-RETICLE-STAGE-001",
    "component": "reticle",
    "claim": "A published ASML patent application describes an EUV reticle stage supporting a reflective reticle with configurable shielding elements.",
    "class": "B",
    "confidence": 0.98,
    "sources": [
      { "name": "EP4239410A1 - Reticle stage", "url": "https://patents.google.com/patent/EP4239410A1/en" }
    ]
  },
  {
    "id": "PATENT-REFLECTIVE-MEMBER-001",
    "component": "projection",
    "claim": "A published ASML patent application describes a lithographic apparatus with an illuminator, reflective patterning device, substrate table and reflective projection system for EUV use.",
    "class": "B",
    "confidence": 0.98,
    "sources": [
      { "name": "US20250328068A1 - Reflective member for EUV lithography", "url": "https://patents.google.com/patent/US20250328068A1/en" }
    ]
  },
  {
    "id": "PATENT-SOURCE-CONTAMINATION-001",
    "component": "source",
    "claim": "A published ASML patent application discusses contamination from plasma target material in an EUV light source and mitigation around collection optics.",
    "class": "B",
    "confidence": 0.98,
    "sources": [
      { "name": "US20240103387A1 - EUV source contamination", "url": "https://patents.google.com/patent/US20240103387A1/en" }
    ]
  },
  {
    "id": "PATENT-DROPLET-ACCELERATOR-001",
    "component": "source",
    "claim": "Published ASML patents describe EUV target droplets and droplet-acceleration concepts within an EUV radiation source.",
    "class": "B",
    "confidence": 0.96,
    "sources": [
      { "name": "US8598551B2 - EUV radiation source comprising a droplet accelerator", "url": "https://patents.google.com/patent/US8598551B2/en" },
      { "name": "US20230164900A1 - Accelerating droplets in a droplet generator", "url": "https://patents.google.com/patent/US20230164900A1/en" }
    ]
  },
  {
    "id": "PATENT-COLLECTOR-MIRROR-001",
    "component": "collector",
    "claim": "A published EUV collector-mirror patent describes a reflecting surface and a pump-light grating concept associated with source/collector operation.",
    "class": "B",
    "confidence": 0.96,
    "sources": [
      { "name": "EP4045949A1 - EUV collector mirror", "url": "https://patents.google.com/patent/EP4045949A1/en" }
    ]
  },
  {
    "id": "PATENT-EUV-MEMBRANE-001",
    "component": "reticle",
    "claim": "A published ASML patent family describes a membrane for EUV lithography associated with the mask/reticle environment.",
    "class": "B",
    "confidence": 0.96,
    "sources": [
      { "name": "WO2017186486A1 - A membrane for EUV lithography", "url": "https://patents.google.com/patent/WO2017186486A1/en" }
    ]
  },
  {
    "id": "ACADEMIC-MOSI-MULTILAYER-001",
    "component": "projection",
    "claim": "Public academic literature studies periodic Mo/Si multilayer mirrors for EUV wavelengths and shows that layer/interface properties materially influence optical performance.",
    "class": "C",
    "confidence": 0.95,
    "sources": [
      { "name": "Structure of periodic Mo/Si multilayers for EUV lithography", "url": "https://arxiv.org/abs/1212.1258" }
    ]
  },
  {
    "id": "ACADEMIC-EUV-MASK-MODEL-001",
    "component": "reticle",
    "claim": "A public refined EUV mask model represents the reflective stack with Mo/Si multilayers, a protective layer and an absorber stack for electromagnetic simulation.",
    "class": "C",
    "confidence": 0.95,
    "sources": [
      { "name": "A refined EUV mask model", "url": "https://arxiv.org/abs/1912.09075" }
    ]
  },
  {
    "id": "INFERRED-SCANNER-MODULE-MAP-001",
    "component": "system",